<?xml version="1.0" encoding="UTF-8" standalone="no"?>
<!DOCTYPE ecpc_CD SYSTEM "cd.dtd">
<ecpc_CD>
<header>
<legislature begin="20040402" end="20080401">VIII</legislature>
<title> DIARIO DE SESIONES DEL CONGRESO DE LOS DIPUTADOS PLENO Y DIPUTACIÓN PERMANENTE Año 2004 VIII Legislatura 	Núm. 5 celebrada el miércoles, 28 de abril de 2004 </title>
<label>Sesión plenaria núm. 5 </label>
<date>celebrada el miércoles, 28 de abril de 2004 </date>
<place>CORTES GENERALES</place>
<edition> DIARIO DE SESIONES DEL CONGRESO DE LOS DIPUTADOS PLENO Y DIPUTACIÓN PERMANENTE Año 2004 VIII Legislatura 	Núm. 5 </edition>
<index>
<indexitem>
ORDEN DEL DÍA:
Toma en consideración de Proposición de reforma del Reglamento del Congreso de los Diputados: — 	Del Grupo Parlamentario Socialista del Congreso, de reforma del Reglamento del Congreso de los Diputados, por la que se modifica el artículo 46.1. «BOCG. Congreso de los Diputados», Serie B, número 69-1, de 23 de abril de 2004. <omit>(Número de expediente 410/000004.)</omit> . . <page_number>Páginas173 </page_number>Tramitación directa y en lectura única de Proposición de reforma del Reglamento del Congreso de los Diputados : — 	Proposición de reforma del Reglamento del Congreso de los Diputados, por la que se modifica el artículo 46.1. «BOCG. Congreso de los Diputados», Serie B, número 69-1, de 23 de abril de 2004. <omit>(Núm. expte. 410/000004.)</omit> . . . . . . . . . . . . . . . . . . . . . . . . . . . . . . . . . . . . . . . . . . . . . . <page_number>Páginas176 </page_number>
</indexitem>
<indexitem>
SUMARIO: 
Se reanuda la sesión a las nueve y cinco minutos de la mañana. Página Toma en consideración de proposición de reforma del Reglamento del Congreso de los Diputados . . . . . . . . . . . . . . . . . <page_number>Páginas173 </page_number>Página Del Grupo Parlamentario Socialista del Congreso, de reforma del Reglamento del Congreso de los Diputados, por la que se modifica el artículo 46.1 . . . . . <page_number>Páginas173 </page_number>
La señora Cunillera i Mestres presenta, en nombre del Grupo Parlamentario Socialista del Congreso, la proposición no de ley que tiene como único objetivo reformar el artículo 46.1 del Reglamento, que se ciñe a las comisiones permanentes legislativas en las que se ordena el trabajo de la Cámara y que sufrió su última revisión el 11 de mayo de 2000. El Real Decreto-ley 562/2004, de 19 de abril, aprueba la estructura orgánica básica de los departamentos ministeriales y la modificación que hoy se somete a la Cámara obedece a una adecuación de las comisiones permanentes legislativas a la estructura de que se ha dotado el Gobierno. Se trata, dice, de sintonizar la estructura del Gobierno y las comisiones legislativas, tal y como ha venido siendo práctica habitual a lo largo de las legislaturas. Resalta la incorporación de una nueva comisión legislativa permanente y muestra su agradecimiento a los grupos minoritarios de las Cámara que van a apoyar la toma en consideración de esta proposición y su posterior aprobación. 
En turno de fijación de posiciones intervienen los señores Jané i Guasch, del Grupo Parlamentario Catalán (Convergència i Unió), y Atencia Robledo, del Grupo Parlamentario Popular en el Congreso. 
Tras dos intentos fallidos de votación electrónica, la Presidencia solicita el voto a mano alzada, quedando aprobada la toma en consideración de la proposición de reforma del artículo 46.1 del Reglamento del Congreso de los Diputados. 
A continuación, la Presidencia, oída la Junta de Portavoces y de conformidad con lo dispuesto en el artículo 150 del Reglamento, somete a la aprobación de la Cámara la tramitación directa y en lectura única por el propio Pleno de la proposición de reforma del artículo 46.1 del Reglamento del Con
greso de los Diputados, lo que se aprueba por asentimiento. 
Se suspende la sesión hasta las diez y treinta minutos, hora en la que concluirá el plazo de presentación de enmiendas. 
Se reanuda la sesión a las diez y cuarenta minutos de la mañana. Página Tramitación directa y en lectura única de proposición de reforma del Reglamento del Congreso de los Diputados . . . . . . <page_number>Páginas176 </page_number>Página Proposición de reforma del Reglamento del Congreso de los Diputados por la que se modifica el artículo 46.1 . . . . . <page_number>Páginas176 </page_number>
El señor Atencia Robledo defiende una enmienda presentada por el Grupo Parlamentario Popular en el Congreso en la que se propone el desdoblamiento de algunas comisiones: una comisión específica de Justicia y otra de Interior, así como una de Fomento y otra de Vivienda. 
Contesta la señora Cunillera i Mestres, en nombre del Grupo Parlamentario Socialista del Congreso, aceptando la propuesta de desdoblamiento de la Comisión de Justicia en Justicia e Interior. 
En turno de fijación de posiciones intervienen los señores Jané i Guasch, del Grupo Parlamentario Catalán (Convergència i Unió), y Atencia Robledo, del Grupo Parlamentario Popular en el Congreso. 
Sometida a votación la enmienda transaccional planteada por el Grupo Parlamentario Socialista del Congreso, se aprueba por 319 votos a favor y dos abstenciones. 
Sometida a votación de conjunto, de acuerdo con el artículo 152 del Reglamento, se aprueba la reforma del Reglamento del Congreso de los Diputados por unanimidad. 
Se levanta la sesión a las diez y cincuenta y cinco minutos de la mañana. 
Se reanuda la sesión a las nueve y cinco minutos de la mañana. 
</indexitem>
</index>
</header>

<body>

<chair who="Marín González, Manuel">

<heading>
TOMA EN CONSIDERACIÓN DE PROPOSI-CIÓN DE REFORMA DEL REGLAMENTO DEL CONGRESO DE LOS DIPUTADOS. — 	DEL GRUPO PARLAMENTARIO SOCIALIS-TA DEL CONGRESO, DE REFORMA DEL REGLAMENTO DEL CONGRESO DE LOS DIPUTADOS, POR LA QUE SE MODIFICA EL ARTÍCULO 46.1. <omit>(Número de expediente 410/000004.)</omit> 
</heading>

<intervention>
<speaker>
<name>MARÍN GONZÁLEZ</name>
<post>PRESIDENTE</post>
</speaker>
<speech language="ES">
 Señorías, se reanuda la sesión. 
Se va a proceder al debate sobre la reforma del Reglamento del Congreso de los Diputados, que tal y como figura en la disposición segunda del propio Reglamento se debe tramitar por el procedimiento establecido para las proposiciones de ley de iniciativa del Congreso. Como se señala también en esta disposición, su aprobación requerirá una votación final de totalidad por mayoría absoluta. El debate se desarrollará de conformidad con lo dispuesto para los debates de totalidad. Asimismo, se ha comunicado a la Mesa que se ha solicitado la tramitación de la iniciativa presentada por el procedimiento de lectura única. Se ha producido un acuerdo de los portavoces, que me ha sido comunicado esta mañana, de que el plazo de enmiendas será de una hora. Así pues, doy por advertidos a los distintos grupos parlamentarios. 
Por parte de los proponentes, tiene la palabra la señora Cunillera. 
En principio el turno a favor es de 15 minutos, pero si puede ahorrar tiempo, mejor. Gracias. 
</speech>
</intervention>

<intervention>
<speaker>
<name>CUNILLERA I MESTRES</name>
<post>NA</post>
</speaker>
<speech language="ES">
 Sí, señor presidente, lo intentaremos. 
Intervengo brevemente para defender la proposición de ley que nuestro grupo presenta hoy a debate y que tiene como único objetivo reformar el artículo 46.1 del Reglamento, que se ciñe a las comisiones permanentes legislativas en las que se ordena el trabajo de la Cámara y que sufrió su última revisión el 11 de mayo de 2000. El Real Decreto-ley 562/2004, de 19 de abril, aprueba la estructura orgánica básica de los departamentos ministeriales. Al igual que en aquel momento, la modificación que hoy sometemos a la Cámara obedece a una adecuación de las comisiones permanentes legislativas a la estructura de que se ha dotado el Gobierno, de tal manera que, en primer lugar, desaparece la Comisión de Ciencia y Tecnología, igual que ha desaparecido el ministerio del mismo nombre, cuyas competencias se han distribuido entre varios ministerios, a saber: los de Industria, Turismo y Comercio y Educación y Ciencia. Estamos, pues, en la desaparición lógica de una comisión existente en la anterior legislatura, comisión que ninguno de nosotros vamos a echar de menos dado la trayectoria que tuvo. Sin embargo, sí me gustaría recordar aquí el vigor y la generosidad con que la defendió en su momento, mayo de 2000, el diputado Núñez, del Grupo Popular, con más voluntad que acierto. A pesar de que la Comisión correspondiente al Ministerio de Ciencia no tuvo el resultado esperado, quisiera recordar al que fue su presidente durante toda la legislatura, el señor Xavier Trías.